,text,true_label,pred_label,true_label_name,pred_label_name,error_type
0,"Opioid antagonists ( e.g. , naltrexone ) and positive modulators of - aminobutyric-acidA ( GABAA ) receptors ( e.g. , alprazolam ) modestly attenuate the abuse-related effects of stimulants like amphetamine .",tensor(3),0,objective,background,objective → background
1,"The general consensus suggests explicit instruction should be provided ; however , when to provide instruction remains unclear .",tensor(1),4,conclusions,results,conclusions → results
2,"We compare these results with previous , contrasting findings to outline a potential framework for understanding when instruction should or should not be delayed .",tensor(2),4,methods,results,methods → results
3,"Over a @-month period , of the @,@ appointments scheduled , @ patient appointments were deemed to be at high risk of a `` no-show '' event .",tensor(0),3,background,objective,background → objective
4,"In a randomised controlled open study , nurses from hospitals and primary healthcare were randomised to either e-learning or classroom teaching .",tensor(3),0,objective,background,objective → background
5,"Before and after a @-day course , the nurses underwent a multiple choice test in drug dose calculations : @ tasks with four alternative answers ( score @-@ ) , and a statement regarding the certainty of each answer ( score @-@ ) .",tensor(3),1,objective,conclusions,objective → conclusions
6,"The number of correct answers after e-learning was @ ( @ ) and after classroom teaching @ ( @ ) ( p = @ , NS ) ; improvement were @ ( @ ) and @ ( @ ) , respectively ( p = @ , NS ) .",tensor(1),4,conclusions,results,conclusions → results
7,The study showed no differences in learning outcome or risk of error between e-learning and classroom teaching in drug dose calculations .,tensor(0),1,background,conclusions,background → conclusions
8,Previous investigation showed that the volume-time curve technique could be an alternative for endotracheal tube ( ETT ) cuff management .,tensor(3),0,objective,background,objective → background
9,"The subjects who received the volume-time curve technique for ETT cuff management presented a significantly lower incidence and severity of sore throat and cough , less thoracic pain , and minimally impaired pulmonary function than those subjects who received the MOV technique during the first @ h after coronary artery bypass grafting .",tensor(3),0,objective,background,objective → background
10,Patients ranged in age from @ years to @years ( mean @ years ) and all completed @year follow-up .,tensor(3),0,objective,background,objective → background
11,No serious related adverse events occurred .,tensor(0),3,background,objective,background → objective
12,Combination therapy resulted in a median number of @ re-treatments at and including month @ .,tensor(1),4,conclusions,results,conclusions → results
13,"Tanner staging was assessed every @ weeks from @ years of age , menarche every @ weeks and height every @-@ weeks .",tensor(1),0,conclusions,background,conclusions → background
14,"Of all intervention participants , @ ( @ % ) reported to have received the basic elements of the intervention .",tensor(4),1,results,conclusions,results → conclusions
15,"Bicalutamide blocks androgen action and is frequently used in men with non-metastatic , castration-resistant prostate cancer ( CRPC ) .",tensor(0),1,background,conclusions,background → conclusions
16,Subjects who completed @ months could participate in the @-year extension .,tensor(4),2,results,methods,results → methods
17,"The estimated median TDP was @ days ( @ % CI @ , @ ) in the bicalutamide/placebo group and @ days ( @ % CI @ , @ ) in the bicalutamide/dutasteride group .",tensor(4),2,results,methods,results → methods
18,"When the body produces less of these hormones , the parts of the body that depend on estrogen to keep them healthy will react and this often causes discomfort for women .",tensor(0),3,background,objective,background → objective
19,Quality of life in menopausal women was greatly improved after @ weeks of yoga practice .,tensor(4),1,results,conclusions,results → conclusions
20,Patients were randomly allocated a once-a-day suppository ( CO@-releasing suppository or placebo ) for @ days .,tensor(3),0,objective,background,objective → background
21,No significant side effects for either treatment were observed .,tensor(2),0,methods,background,methods → background
22,"Despite potentially increased risks of persistent trophoblast and repeat ectopic pregnancy , salpingotomy is often preferred over salpingectomy because the preservation of both tubes is assumed to offer favourable fertility prospects , although little evidence exists to support this assumption .",tensor(1),0,conclusions,background,conclusions → background
23,"Differences in cumulative ongoing pregnancy rates were expressed as a fecundity rate ratio with @ % CI , calculated by Cox proportional-hazards analysis with a time horizon of @ months .",tensor(2),4,methods,results,methods → results
24,"Secondary outcomes were persistent trophoblast and repeat ectopic pregnancy ( expressed as relative risks -LSB- RRs -RSB- with @ % CIs ) and ongoing pregnancy after ovulation induction , intrauterine insemination , or IVF .",tensor(3),0,objective,background,objective → background
25,We also did a ( non-prespecified ) meta-analysis that included the findings from the present trial .,tensor(3),2,objective,methods,objective → methods
26,"Repeat ectopic pregnancy occurred in @ women ( @ % ) in the salpingotomy group and @ ( @ % ) women in the salpingectomy group ( RR @ , @-@ ) .",tensor(4),1,results,conclusions,results → conclusions
27,High-sensitivity cardiac troponin is the best single marker .,tensor(2),4,methods,results,methods → results
28,"Multivariate ANOVAs with post hoc tests revealed significant and comparable reductions of dysfunctional tinnitus-related cognitions for both treatments ( GCBT and ICBT ) , which remained stable over a @ - and @-month period .",tensor(1),4,conclusions,results,conclusions → results
29,"Negative correlations were found between the catastrophic subscale of the T-Cog and therapy outcome for ICBT , but not for GCBT .",tensor(3),0,objective,background,objective → background
30,Both forms of CBT are successful in reducing dysfunctional tinnitus-related cognitions .,tensor(3),0,objective,background,objective → background
31,Handling emergency telephone consultations ( ETCs ) is a challenging and very important task for doctors .,tensor(3),0,objective,background,objective → background
32,"We used ETCs with simulated patients ( SPs ) , with each student randomly allocated two of four possible cases .",tensor(3),1,objective,conclusions,objective → conclusions
33,"ETC training in medical schools , with a focus on structured history taking and formulating discriminating questions , might help decrease insecurity in ETCs .",tensor(0),3,background,objective,background → objective
34,"Furthermore , use of preemptive or postoperative paracetamol reduces total fentanyl requirements in the first @ h postoperatively providing a safe and effective postoperative analgesia .",tensor(3),0,objective,background,objective → background
35,This study sought to investigate whether periprocedural ischemic DWI lesions after CAS or carotid endarterectomy ( CEA ) are associated with an increased risk of recurrent cerebrovascular events .,tensor(1),4,conclusions,results,conclusions → results
36,Ischemic brain lesions discovered on DWI after CAS seem to be a marker of increased risk for recurrent cerebrovascular events .,tensor(0),4,background,results,background → results
37,Eligibility criteria were women with signs of incomplete abortion .,tensor(0),1,background,conclusions,background → conclusions
38,"From April @ , @ , to July @ , @ , @ women were assessed for eligibility .",tensor(3),0,objective,background,objective → background
39,@ women were randomly assigned to each group ( @ to midwife group and @ to physician group ) .,tensor(3),0,objective,background,objective → background
40,"Recruitment of patients into interventions in clinical practice settings is difficult due to limited time available in the clinic , identification of appropriate personnel to efficiently conduct the process , and time-consuming methods of recruitment .",tensor(0),3,background,objective,background → objective
41,"Using this approach , a high proportion of potentially eligible veterans were screened by their PCPs .",tensor(0),1,background,conclusions,background → conclusions
42,"During CABG , clevidipine was not inferior to NTG for blood pressure control pre-bypass .",tensor(4),2,results,methods,results → methods
43,"No significant difference was observed between the irritation grades of group A and B ( Z = -@ , P = @ ) ; the duration of irritative symptom was significantly shorter in group A than that in group B ( Z = -@ , P = @ ) .",tensor(0),2,background,methods,background → methods
44,No significant difference was observed between the time of healing and visual acuity recovery of the two groups .,tensor(2),4,methods,results,methods → results
45,"@ % bromfenac sodium eye drops can effectively relieve the post-LASEK irritative symptoms , and it is better tolerated than @ % ketorolac tromethamine eye drops .",tensor(2),0,methods,background,methods → background
46,Postnatal common mental disorders among women are an important public health problem internationally .,tensor(4),2,results,methods,results → methods
47,"What Were We Thinking ( WWWT ) is a structured , gender-informed , psychoeducational group programme for parents and their first infant that addresses two modifiable risks to postnatal mental health .",tensor(1),0,conclusions,background,conclusions → background
48,"QOL issues , such as emotional condition , functional status , and additional concerns , demonstrated a remarkable improvement in the fat-filling group at postoperative @mo compared with the non-filling ( control ) group .",tensor(3),0,objective,background,objective → background
49,This novel procedure significantly improved patient QOL and may prove useful as a relatively safe preventive surgical adjunct operation for refractory cough .,tensor(2),4,methods,results,methods → results
50,Modafinil has been reported to benefit a subgroup of patients suffering severe fatigue while undergoing chemotherapy .,tensor(2),4,methods,results,methods → results
51,We investigated whether modafinil could reduce fatigue during docetaxel chemotherapy .,tensor(0),1,background,conclusions,background → conclusions
52,"This multicenter , randomized , double-blind , placebo-controlled study evaluated the efficacy of modafinil in patients with metastatic prostate or breast cancer undergoing docetaxel chemotherapy ( every @ days ; minimum dose @ mg/m ( @ ) ) .",tensor(1),4,conclusions,results,conclusions → results
53,"After detoxification , @ patients were randomized into @ groups as follows : @ patients received @ mg of TOP ( oral , twice daily ) , titrated over @ weeks , and @ patients received placebo ( PLA ) .",tensor(4),2,results,methods,results → methods
54,"Opioid consumption significantly decreased in Group I ( P < @ during first @ months and @ at the last assessment time ) , with concomitant significant reduction in related side effects .",tensor(0),1,background,conclusions,background → conclusions
55,"To study the effects of oromucosal detomidine gel administered sublingually to calves prior to disbudding , and to compare its efficacy with intravenously ( IV ) administered detomidine .",tensor(4),2,results,methods,results → methods
56,No complications of the procedure were recorded in the Preconditioning group .,tensor(4),1,results,conclusions,results → conclusions
57,"The application of this technique of preconditioning was associated with certain benefits , including improved left ventricular function after weaning from cardiopulmonary bypass and a reduced need for inotropic support .",tensor(2),4,methods,results,methods → results
58,Minimal-change nephrotic syndrome ( MCNS ) is a common cause of steroid sensitive nephrotic syndrome ( NS ) with frequent relapse .,tensor(1),0,conclusions,background,conclusions → background
59,Seventeen of these received a second course of RTX and then had a complete ( n = @ ) or partial ( n = @ ) clinical response .,tensor(0),3,background,objective,background → objective
60,RTX is safe and effective in adult patients with MCNS and could be an alternative to steroids or CNIs in patients with a long history of relapsing MCNS .,tensor(3),0,objective,background,objective → background
61,CRP levels did not show significant variation in the first three time periods .,tensor(1),0,conclusions,background,conclusions → background
62,The intravitreal concentration continued to increase gradually until @ hours ( @ @ mg/g ) .,tensor(2),4,methods,results,methods → results
63,Intravenous concentration of carboplatin was undetectable in all patients .,tensor(3),0,objective,background,objective → background
64,Serial wide-field fluorescein angiography was performed on eyes with preproliferative ( ischemic ) central retinal vein occlusion to evaluate retinal perfusion .,tensor(3),0,objective,background,objective → background
65,"Glucocorticoids may reduce postoperative inflammatory responses and enhance recovery , but with limited information on EVAR .",tensor(0),1,background,conclusions,background → conclusions
66,Primary outcome was a modified version of the systemic inflammatory response syndrome .,tensor(3),0,objective,background,objective → background
67,The present study tested the hypothesis that pretreatment with metformin decreases postprocedural myocardial injury and improves clinical outcomes in metabolic syndrome patients following percutaneous coronary intervention ( PCI ) .,tensor(3),0,objective,background,objective → background
68,We enrolled @ metabolic syndrome patients with no prior history of metformin treatment .,tensor(0),3,background,objective,background → objective
69,@ middle-aged BCSs with chronic insomnia .,tensor(4),2,results,methods,results → methods
70,"Sleep outcomes ( e.g. , sleep efficiency , sleep latency , total sleep time , wake after sleep onset , number of nightly awakenings ) ; secondary variables included sleep medication use , insomnia severity , QOL , physical function , cognitive function , fatigue , depression , anxiety , and sleep attitudes or knowledge .",tensor(1),4,conclusions,results,conclusions → results
71,Patients in Group A were needled at right Waiguan ( SJ@ ) .,tensor(4),1,results,conclusions,results → conclusions
72,Patients ' satisfaction and preference in treatment were also assessed .,tensor(1),4,conclusions,results,conclusions → results
73,The immediate effects ( @-week follow-up ) were better with the Q-switched Nd : YAG laser but there was no great difference between the two laser types at @-month follow-up due to the greater degree of post-inflammatory hyperpigmentation following Q-switched Nd : YAG .,tensor(0),3,background,objective,background → objective
74,"Daclizumab HYP is characterized by slow clearance , linear pharmacokinetics ( at doses@mg ) , high subcutaneous bioavailability , and a half-life suitable for monthly administration .",tensor(0),4,background,results,background → results
75,The primary end point was mortality at day @ .,tensor(4),1,results,conclusions,results → conclusions
76,"There was also no significant difference in mortality at @ days , with @ deaths ( @ % ) and @ deaths ( @ % ) , respectively ( hazard ratio , @ ; @ % CI , @ to @ ; P = @ ) .",tensor(0),2,background,methods,background → methods
77,The breast-conserving surgery rate was @ % ( @ % CI = @-@ @ ) in the anastrozole arm and @ % ( @ % CI = @-@ @ ) in the fulvestrant arm .,tensor(4),2,results,methods,results → methods
78,"The Ki-@ score fell after treatment but there was no significant difference between the reduction in the two arms ( anastrozole @ % ( @ % CI = @-@ @ ) before , @ % ( @ % CI = @-@ @ ) after , n = @ ; fulvestrant @ % ( @ % CI = @-@ @ ) before , @ % ( @ % CI = @-@ @ ) after , n = @ ) or between the reduction in Ki-@ in clinical responders and non-responders .",tensor(1),4,conclusions,results,conclusions → results
79,The purpose of the present study is to evaluate the impact of a health psychology-led bariatric rehabilitation service ( BRS ) on patient weight loss following bariatric surgery at @ year .,tensor(3),0,objective,background,objective → background
80,A single-site open-randomised parallel group control trial based at St. Richard 's Hospital in Chichester in the UK .,tensor(1),0,conclusions,background,conclusions → background
81,Patients ( n = @ ) were recruited immediately prior to Roux-en-Y gastric bypass and randomly allocated to receive either treatment as usual ( n = @ ) or the BRS ( n = @ ) .,tensor(3),0,objective,background,objective → background
82,"The BRS involved three @-min one-to-one sessions with a health psychologist and provided information , support and mentoring pre and post surgery addressing psychological issues such as dietary control , self esteem , coping and emotional eating .",tensor(4),2,results,methods,results → methods
83,The key outcome variable was BMI and change in BMI .,tensor(3),0,objective,background,objective → background
84,Intention-to-treat analysis ( n = @ ) using last measured weights showed that mean change in BMI by @ year post surgery was -@ .,tensor(1),4,conclusions,results,conclusions → results
85,"To date , the Orsiro Hybrid sirolimus-eluting stent has excelled in terms of late lumen loss at @ months in a first-in-man single-arm trial .",tensor(4),1,results,conclusions,results → conclusions
86,Six weeks of triple therapy was not superior to @ months with respect to net clinical outcomes .,tensor(1),4,conclusions,results,conclusions → results
87,These results suggest that physicians should weigh the trade-off between ischemic and bleeding risk when choosing the shorter or longer duration of triple therapy .,tensor(0),3,background,objective,background → objective
88,To compare the effects of a @-week supplementation between two different mixtures of antioxidants and placebo on aerobic exercise performance in acute normobaric hypoxia .,tensor(1),4,conclusions,results,conclusions → results
89,"Seventeen subjects were randomly assigned in a double-blind fashion to receive a broad-based antioxidants supplement containing beta-carotene , ascorbic acid , d-alpha-tocopherol-succinate , N-acetylcysteine , riboflavin , zinc , and selenium ( antioxidant capsule group -LSB- AO group -RSB- ) , or a combination of alpha-ketoglutaric acid ( - KG ) and @-hydroxymethylfurfural ( @-HMF ; CYL concentrate supplementation group -LSB- CS group -RSB- ) , or placebo ( PL group ) .",tensor(0),1,background,conclusions,background → conclusions
90,"The first test was conducted under normoxic conditions ( LA , FiO@ of @ % , ~ @ m ) and the second after the @-week supplementation period under normobaric hypoxic conditions ( AHA , FiO@ of @ % , ~ @m ) .",tensor(4),2,results,methods,results → methods
91,In CS peak cycling performance ( peak power ) declined from LA to AHA @ % ( @ % CI : @-@ @ ) less compared with PL ( p = @ ) and @ % ( @ % CI : @-@ @ ) less compared with AO ( p = @ ) .,tensor(4),2,results,methods,results → methods
92,Safety data were collected for patients treated with @ dose of CZP .,tensor(1),0,conclusions,background,conclusions → background
93,"Of the @ patients who were randomized , @ received CZP from week @ .",tensor(0),3,background,objective,background → objective
94,Clinical improvements to week @ in both CZP dosing regimens were sustained to week @ .,tensor(1),0,conclusions,background,conclusions → background
95,"In patients with an MMRS < @ , TRA was used in @,@ ( @ % ) of @,@ PCI procedures ; TRA was used in @,@ ( @ % ) of @,@ PCI procedures in patients with an MMRS @ , illustrating that TRA was used less in those at highest risk from bleeding complications ( p < @ ) .",tensor(4),2,results,methods,results → methods
96,"TRA was independently associated with reduced @-day mortality , and the magnitude of this effect was related to baseline bleeding risk ; those at highest risk of bleeding complications gained the greatest benefit from adoption of TRA during PCI .",tensor(2),0,methods,background,methods → background
97,Patients with severe acute exacerbations of asthma often receive inappropriate antibiotic treatment .,tensor(1),0,conclusions,background,conclusions → background
98,"Compared with placebo , azithromycin treatment did not reduce serum IL-@ levels at day @ ( P = @ ) but resulted in a greater decrease in nasal lavage fluid IL-@ levels by day @ ( P = @ ) .",tensor(0),2,background,methods,background → methods
99,"Median OS was @ and @ months in the panitumumab and bevacizumab arms , respectively ( HR , @ ; @ % CI , @ to @ ; P = @ ) .",tensor(0),2,background,methods,background → methods
100,Patients with WT RAS tumors seemed to experience more clinical benefit with anti-epidermal growth factor receptor therapy .,tensor(4),1,results,conclusions,results → conclusions
101,Definitive restorations were placed after a minimum transgingival healing period of @ weeks .,tensor(0),3,background,objective,background → objective
102,Sixty-eight patients received @ implants in the platform switching group and @ in the other one .,tensor(0),2,background,methods,background → methods
103,Pronounced nasojugal groove ( tear trough deformity ) is one of the landmarks of aging .,tensor(2),3,methods,objective,methods → objective
104,Hyaluronic acid filler can be used for attenuating the nasojugal sulcus but irregular lumpness and overcorrection are common adverse reactions .,tensor(3),0,objective,background,objective → background
105,Duration of overall effect varied among the patients .,tensor(2),4,methods,results,methods → results
106,Restylane Vital injector offers more predictable results and a lower incidence of adverse effects than more commonly used techniques .,tensor(1),0,conclusions,background,conclusions → background
107,Hyaluronic acid filler intradermal injection with special injector is a safe and effective method for correction of nasojugal groove .,tensor(0),3,background,objective,background → objective
108,The therapeutic methods were same as the acupuncture-moxibustion group and the Chinese medication group .,tensor(2),4,methods,results,methods → results
109,"This was a single-center , randomized clinical trial performed at Kamuzu Central Hospital , Lilongwe , Malawi .",tensor(1),4,conclusions,results,conclusions → results
110,"Overall postoperative mortality was @ % , with a higher mortality rate in the control group compared with the intervention group ( @ % and @ % , respectively ; P = @ -LSB- @ % CI , @-@ @ -RSB- ) .",tensor(4),2,results,methods,results → methods
111,"Patients were @ right-handed or ambidextrous men and women aged between @ and @ years , with OSA and persistent sleepiness , as determined by multiple sleep latency and Epworth Sleepiness Scale scores , despite effective , stable use of CPAP .",tensor(3),0,objective,background,objective → background
112,The key secondary measure was the change in task response latency .,tensor(1),0,conclusions,background,conclusions → background
113,Childhood obesity is a growing concern in Sweden .,tensor(4),2,results,methods,results → methods
114,"Children with overweight and obesity run a high risk of becoming obese as adults , and are likely to develop comorbidities .",tensor(2),4,methods,results,methods → results
115,"Despite the immense demand , there is still a lack of evidence-based comprehensive prevention programmes targeting pre-school children and their families in primary health care settings .",tensor(4),2,results,methods,results → methods
116,The PRIMROSE trial targets first-time parents and their children at Swedish child health centres ( CHC ) in eight counties in Sweden .,tensor(1),4,conclusions,results,conclusions → results
117,"The intervention programme , starting when the child is @-@months of age and ending at age @ , is based on social cognitive theory and employs motivational interviewing .",tensor(3),2,objective,methods,objective → methods
118,"Secondary outcomes are children 's and mothers ' eating habits ( assessed by a food frequency questionnaire ) , and children 's and mothers ' physical activity ( measured by accelerometer and a validated questionnaire ) , and mothers ' body mass index and waist circumference .",tensor(1),4,conclusions,results,conclusions → results
119,"The plasma concentration in the lutein group was significantly higher than in controls at @ and @ months ( P < @ for both comparisons ) ; however , the MPOD values did not differ significantly between groups at @ ( P = @ ) or @ months ( P = @ ) .",tensor(3),0,objective,background,objective → background
120,"In patients with a plasma lutein concentration below the mean level in @ age-matched healthy subjects ( mean @ ng/mL ; n = @ in lutein group , n = @ in control group ) , the control MPOD values significantly ( P = @ ) decreased at @ months ( mean baseline , @ DU ; @ months , @ DU ) .",tensor(3),0,objective,background,objective → background
121,The aim of this study was to investigate the effect of two different resuscitation fluid strategies on the mortality of patients with shock .,tensor(0),1,background,conclusions,background → conclusions
