,text,true_label,pred_label,true_label_name,pred_label_name,error_type
122,Both cohorts received maintenance fluids consisting in isotonic crystalloids and albumin in case of severe hypoalbuminemia ( < @ g/dL ) .,tensor(4),2,results,methods,results → methods
123,We discussed herein some methodological issues that may explain the discrepancies of this trial with the other studies developed in the same field .,tensor(0),2,background,methods,background → methods
124,Preserved residual acoustic hearing has a positive effect on speech intelligibility in difficult noise conditions .,tensor(0),3,background,objective,background → objective
125,Speech perception in noise was measured for bilateral CI and EAS patient groups .,tensor(0),3,background,objective,background → objective
126,Speech reception thresholds ( SRT ) were measured using a closed-set sentence matrix test .,tensor(1),0,conclusions,background,conclusions → background
127,This effect was absent in both implanted user groups .,tensor(0),3,background,objective,background → objective
128,Relative vaccine efficacy in severe influenza was @ % ( @ % CI : @-@ @ ) .,tensor(1),4,conclusions,results,conclusions → results
129,"Participants were @ % female with a mean age and body mass index of @ y and @ kg/m ( @ ) , respectively .",tensor(3),0,objective,background,objective → background
130,"Changes from baseline in LMTT Matsuda insulin sensitivity index ( -@ vs. -@ , respectively ; baseline = @ ) and mean HOMA@ -- cell function ( -@ vs. @ % , respectively ; baseline = @ % ) did not differ significantly between treatments .",tensor(1),0,conclusions,background,conclusions → background
131,Treatment with methylphenidate ( MPD ) has improved learning disabilities in ADHD by acting on neurotransmitters .,tensor(3),2,objective,methods,objective → methods
132,Thirty-nine patients were included between April @ and December @ .,tensor(4),1,results,conclusions,results → conclusions
133,"From January to December @ , @ consecutive patients undergoing a liver resection were randomized to the radiofrequency vessel-sealing system ( LF@ group ; N = @ ) or to the clamp-crushing technique ( Kelly group , N = @ ) .",tensor(4),2,results,methods,results → methods
134,We conducted a randomized pilot study of NMES vs sham applied to @ bilateral lower extremity muscle groups for @ minutes daily in the intensive care unit ( ICU ) .,tensor(2),0,methods,background,methods → background
135,"Between June @ and March @ , we enrolled adults who were receiving mechanical ventilation within the first week of ICU stay and who could transfer independently from bed to chair before hospital admission .",tensor(4),2,results,methods,results → methods
136,"Finally , both groups had higher QoL scores after treatment , with all assessed parameters except environment showing a significant improvement ( all P less than @ ) .",tensor(4),2,results,methods,results → methods
137,Progressive decline of psychophysical cone-mediated measures has been reported in type @ ( USH@ ) and type @ ( USH@ ) Usher syndrome .,tensor(0),3,background,objective,background → objective
138,We evaluated cone signals in USH@ and USH@ by recording microvolt level cycle-by-cycle ( CxC ) ERG .,tensor(4),1,results,conclusions,results → conclusions
139,"The CxC ERG method provided reliable responses in all subjects , whereas conventional ERG was undetectable in @ of @ subjects .",tensor(1),4,conclusions,results,conclusions → results
140,@ Japanese and @ Caucasian healthy subjects were enrolled .,tensor(4),2,results,methods,results → methods
141,Isthmic spondylolisthesis was not more prevalent than what has been reported in other populations .,tensor(4),2,results,methods,results → methods
142,@ patients were included for analysis .,tensor(2),4,methods,results,methods → results
143,"The AUC was greatest for the @-hDS ( @ ) , followed by the @-h % FEV@ ( @ ) .",tensor(0),1,background,conclusions,background → conclusions
144,These were associated with a + LR for the composite outcome of @ and @ respectively .,tensor(3),0,objective,background,objective → background
145,The @-hscore for % FEV@ and DS performed better than scores at any other time point and better than either parameter over time .,tensor(1),4,conclusions,results,conclusions → results
146,Sarcopenia is currently best described as an age-related decline in skeletal muscle mass and function .,tensor(0),3,background,objective,background → objective
147,"Twenty-five older adults ( @ y ; BMI = @ kgm ( -@ ) ) completed a @-week resistance training program in a wait-list controlled , cross-over design .",tensor(3),0,objective,background,objective → background
148,"In this study , we explore the role of vascular senescence in premature CAD ( PCAD ) in a developing country by comparing the numerical status and senescence of circulating EPCs in PCAD patients to controls .",tensor(0),1,background,conclusions,background → conclusions
149,"EPCs were measured by flow cytometry in @ patients with angiographically documented CAD , and @ controls without evidence of CAD , recruited from random patients @ years of age at All India Institute of Medical Sciences .",tensor(3),0,objective,background,objective → background
150,"Three treatments were taken as one course , and totally one course was given .",tensor(4),0,results,background,results → background
151,The control group was treated with oral administration of loratadine and nasal spray of budesonide .,tensor(0),3,background,objective,background → objective
152,"After treatment , both groups effectively reduced the contents of IgE , IL-@ , IL-@ and TNF - , and the observation group had superior effect on reducing IgE and IL-@ to the control group ( P < @ ) .",tensor(4),1,results,conclusions,results → conclusions
153,The medicinal vesiculation combined with quick cupping at Shenque ( CV @ ) have better effect for allergic rhinitis with syndrome of yang deficiency than oral administration of loratadine and nasal spray of budesonide .,tensor(4),2,results,methods,results → methods
154,Tamsulosin and mirabegron may be used concomitantly in patients with lower urinary tract symptoms .,tensor(2),0,methods,background,methods → background
155,"Since alpha@-adrenoceptor antagonists are associated with cardiovascular side effects , potential pharmacokinetic and cardiovascular interactions were evaluated .",tensor(4),2,results,methods,results → methods
156,"In arm @ , subjects received single-dose tamsulosin hydrochloride modified release capsules ( @ mg ) alone and with steady-state mirabegron oral controlled absorption system tablets ( @ mg once daily ) in random sequence .",tensor(0),3,background,objective,background → objective
157,Both groups were treated by standard pharmacotherapy and SLIT with Dermatophagoides farinae ( American HDM ) extracts for @ weeks .,tensor(1),4,conclusions,results,conclusions → results
158,"Cyclic guanosine monophosphate ( cGMP ) signaling affects energy balance , IR , and glucose metabolism in experimental models .",tensor(3),2,objective,methods,objective → methods
159,"Oral glucose tolerance tests were performed , and the effect of tadalafil on IR was examined .",tensor(0),3,background,objective,background → objective
160,"A total of @ participants ( mean age , @ years ; body mass index -LSB- BMI -RSB- , @ kg/m ( @ ) ) were analyzed , @ randomized to tadalafil and @ to placebo .",tensor(4),2,results,methods,results → methods
161,"However , in individuals with severe obesity ( BMI @ kg/m ( @ ) ) , tadalafil use was associated with improved IR ( homeostatic model assessment for IR ) , compared to placebo ( P = @ , respectively ) .",tensor(4),2,results,methods,results → methods
162,"Adult patients ( n = @ , @-@ years ) admitted with a smoking-related illnesses to @ hospitals were randomized to receive either @ weeks of varenicline tartrate ( titrated from @ mg daily to @mg twice daily ) plus quitline-counseling ( VT+C ) , ( n = @ ) or quitline-counseling alone ( n = @ ) .",tensor(4),1,results,conclusions,results → conclusions
163,"VT was well tolerated in the inpatient setting among subjects admitted with acute smoking-related illnesses ( mean age @ and @ years in the VT+C and counseling alone groups , respectively ) .",tensor(1),4,conclusions,results,conclusions → results
164,Forty ceramic specimens were fabricated .,tensor(1),0,conclusions,background,conclusions → background
165,A mean E ( SD ) of @ ( @ ) for VC and @ ( @ ) for @D was observed ( P = @ ) .,tensor(4),2,results,methods,results → methods
166,"Compared with direct shade matching using VC , the indirect method with the optimized tables resulted in a mean E of @ ( @ ) , which was not significantly different ( P = @ ) .",tensor(3),0,objective,background,objective → background
167,It has been proposed that fatty acids ( FAs ) are potential factors that influence oocyte maturation and subsequent embryo development .,tensor(2),4,methods,results,methods → results
168,"There was no significant difference between @ ppm F and @,@ ppm F for % SMHR and between @,@ ppm F and @,@ ppm F for % SMHR , EFU and % NAR .",tensor(4),1,results,conclusions,results → conclusions
169,Progression-free survival was significantly better with dose escalation .,tensor(1),4,conclusions,results,conclusions → results
170,"Abdominal obesity and exaggerated postprandial lipemia are independent risk factors for cardiovascular disease ( CVD ) and mortality , and both are affected by dietary behavior .",tensor(3),0,objective,background,objective → background
171,This trial was registered at clinicaltrials.gov as NCT@ .,tensor(4),1,results,conclusions,results → conclusions
172,This resulted in a @ % reduction in drug cost from before dose reduction ( P < @ ) .,tensor(2),3,methods,objective,methods → objective
173,Disease relapsed in @ patients who received clinically based dosing ( @ % ) and @ patients who received concentration-based dosing ( @ % ) ( P = @ ) .,tensor(1),0,conclusions,background,conclusions → background
174,Cross-sectional study .,tensor(1),4,conclusions,results,conclusions → results
175,"After informed consent , volunteers were randomized to @ of the @ visual field defects listed above .",tensor(3),0,objective,background,objective → background
176,Three patients in the Saline group had an episode of oxygen desaturation requiring oxygen therapy .,tensor(1),0,conclusions,background,conclusions → background
177,"In this double-blind , placebo-controlled , parallel-group study in adults with a history of migraine with or without aura , participants were randomized via computer-generated lists to AVP-@ or placebo device to treat a single migraine headache of moderate or severe intensity .",tensor(3),0,objective,background,objective → background
178,Thirty-four percent of patients treated with AVP-@ were pain-free at @ hours compared with @ % using the placebo device ( P = @ ) .,tensor(3),0,objective,background,objective → background
179,"Chest pain or pressure was not reported , and only one patient taking AVP-@ reported mild paresthesia .",tensor(0),2,background,methods,background → methods
180,No other triptan sensations were reported .,tensor(1),4,conclusions,results,conclusions → results
181,The treatment was well tolerated with a low incidence of systemic AEs .,tensor(1),4,conclusions,results,conclusions → results
182,The primary outcome was pain with IUD placement on a @-cm visual analog scale .,tensor(1),0,conclusions,background,conclusions → background
183,The primary outcome was the change in right thigh muscle volume by MRI at @ weeks .,tensor(0),3,background,objective,background → objective
184,"Guided by a multi-level , conceptual framework that emphasizes changes in provider beliefs and organizational characteristics as drivers of improvement in tobacco treatment delivery , the current protocol will use a cluster , randomized design and multiple data sources ( patient exit interviews , provider surveys , site observations , chart audits , and semi-structured provider interviews ) to study the process of implementing clinical practice guidelines for treating tobacco dependence in @ public dental care clinics in New York City .",tensor(4),1,results,conclusions,results → conclusions
185,"The findings will improve knowledge pertinent to the implementation , dissemination , and sustained utilization of evidence-based tobacco use treatment in dental practices .",tensor(3),0,objective,background,objective → background
186,"To determine if the addition of NE to usual preoperative education would result in superior outcomes with regard to pain , function , surgical experience , and health care utilization postsurgery .",tensor(0),3,background,objective,background → objective
187,Prophylactic use of LMWH is safe and convenient .,tensor(4),2,results,methods,results → methods
188,Postprandial insulin and triglyceride responses were significantly lower at the end of the intervention in the whole-grain group compared to the control group ( p = @ and p = @ ; respectively ) whereas there was no change in postprandial response of glucose and other parameters evaluated .,tensor(4),2,results,methods,results → methods
189,"Secondary outcomes included pain from these ulcers ( measured on a @-mm visual-analogue scale , with higher scores indicating worse pain ) , the number of genital ulcers , overall disease activity , and quality of life .",tensor(3),0,objective,background,objective → background
190,"Apremilast was effective in treating oral ulcers , which are the cardinal manifestation of Behet 's syndrome .",tensor(1),2,conclusions,methods,conclusions → methods
191,"Leg compression is considered basic treatment for superficial vein thrombosis ( SVT ) , although scientific proof for its efficacy is lacking .",tensor(4),2,results,methods,results → methods
192,"Clinical symptoms and QoL significantly improved from baseline to day @ in both groups ( p < @ for VAS , Lowenberg test , thrombus length , and erythema ; p < @ for QoL ) , and consumption of analgesics and D-dimer significantly decreased ( p < @ ) .",tensor(3),1,objective,conclusions,objective → conclusions
193,All data were transferred to SPSS software .,tensor(4),2,results,methods,results → methods
194,There were no demographic differences between groups .,tensor(1),4,conclusions,results,conclusions → results
195,"No feet developed wound complications in minimally invasive group , but incision complications occurred in @ feet in routine group .",tensor(2),4,methods,results,methods → results
196,We aim to compare citrate @ % catheter lock solution versus heparin in terms of event-free survival of the first non-tunneled hemodialysis catheter inserted in ICU patients with AKI requiring RRT .,tensor(0),1,background,conclusions,background → conclusions
197,"The VERROU-REA study is a randomized , prospective , multicenter , double-blind , parallel-group , controlled superiority study carried out in the medical , surgical and nephrological ICUs of two large university hospitals in eastern France .",tensor(3),2,objective,methods,objective → methods
198,"The research control group consisted of @ patients , the analgesia group consisted of @ , and the heat patch group consisted of @ .",tensor(3),0,objective,background,objective → background
199,"In a @-month , multicenter randomized , double-blind , placebo-controlled trial , CADASIL patients aged @ to @ years were randomly assigned to receive placebo or sapropterin @ to @ mg BID .",tensor(1),4,conclusions,results,conclusions → results
200,"Reactive hyperemia index by peripheral arterial tonometry increased after @ months in @ % of patients on sapropterin and in @ % on placebo ; however , after adjustment for age , sex , and clinical characteristics , improvement was not associated with treatment arm .",tensor(1),0,conclusions,background,conclusions → background
201,"The proportion of patients with adverse events was similar on sapropterin and on placebo ( @ % versus @ % ) ; serious adverse events occurred in @ % versus @ % , respectively .",tensor(1),0,conclusions,background,conclusions → background
202,"Sapropterin was safe and well-tolerated at the average dose of @ mg/kg/day , but did not affect endothelium-dependent vasodilation in CADASIL patients .",tensor(1),4,conclusions,results,conclusions → results
203,"There were no significant differences by intervention group in targeted risks , the prevalence of past-month or past-year substance use , or past-year delinquency or violence .",tensor(4),1,results,conclusions,results → conclusions
204,"Even though LC for acute and gangrenous cholecystitis is technically demanding , in experienced hands it is safe and effective .",tensor(3),0,objective,background,objective → background
205,"In alcohol dependent patients , the treatmentcommitment strength interaction was significant ( p = @ ) ; patients with low commitment strength had better outcomes in MI+H ealthCall than in MI-only ( lower mean drinks per drinking day ; @ and @ drinks , respectively ) .",tensor(3),0,objective,background,objective → background
206,Replication is warranted .,tensor(1),4,conclusions,results,conclusions → results
207,A total of @ students of @ Dutch secondary schools .,tensor(0),1,background,conclusions,background → conclusions
208,"Secondary objectives are to evaluate the effect of preoperative inspiratory muscle training on length of hospital stay , duration of mechanical ventilation , incidence of other postoperative ( pulmonary ) complications , quality of life , and on postoperative respiratory muscle function and lung function .",tensor(2),0,methods,background,methods → background
209,We conducted a prospective randomly assigned study from April @ to February @ at Asan Medical Center .,tensor(3),0,objective,background,objective → background
210,Participants were randomly assigned to consume either the control ( n = @ ) or the DASH diet ( n = @ ) for @ weeks .,tensor(2),0,methods,background,methods → background
211,"Up to now only a few studies have investigated these influences , and still less has been attempted to remove/reduce these influences .",tensor(4),1,results,conclusions,results → conclusions
212,"We introduce the use of three different signal processing approaches ( spatial filtering , a common average reference ( CAR ) method ; independent component analysis ( ICA ) ; and transfer function ( TF ) models ) to reduce the influence of respiratory and blood pressure ( BP ) rhythms on the hemodynamic responses .",tensor(4),2,results,methods,results → methods
213,Six months after the onset of therapy practically all patients reached the target AD level ( @ % in group @ and @ % in group ) .,tensor(1),4,conclusions,results,conclusions → results
214,One larynx in each group failed at < @ cycles .,tensor(1),4,conclusions,results,conclusions → results
215,"All three studies assessed day @ treatment success , defined as complete or partial clinical evidence of clear nail growth plus negative fungal culture .",tensor(1),4,conclusions,results,conclusions → results
216,"Application-site reactions of general irritation , erythema , scaling , and stinging/burning were most common with tavaborole @ % , were generally mild to moderate , and resolved with treatment discontinuation and/or a reduction in dosing frequency .",tensor(4),1,results,conclusions,results → conclusions
217,Tavaborole solution demonstrated favorable efficacy and safety in phase @ clinical studies .,tensor(4),2,results,methods,results → methods
218,The population PK analysis was performed by NONMEM .,tensor(2),4,methods,results,methods → results
219,A population PK model of rhTNFR - Fc was developed in Chinese patients with RA .,tensor(1),4,conclusions,results,conclusions → results
220,"In total , @ patients were assigned randomly to partial and total uncinectomy groups .",tensor(1),0,conclusions,background,conclusions → background
221,All patients completed the follow-up and were included in the analysis .,tensor(1),4,conclusions,results,conclusions → results
222,"This was an @-week , parallel-group , placebo-controlled trial undertaken at two universities affiliated psychiatric Hospitals in Iran .",tensor(2),4,methods,results,methods → results
223,"For general subscale scores , the main effect comparing two types of intervention was not significant -LSB- F ( @ , @ ) = @ , p = @ -RSB- .",tensor(2),4,methods,results,methods → results
224,"When analyzing the THI scores and VAS pre-rTMS and @ months after rTMS , significant decreases were observed in patients overall ( P < @ ) .",tensor(4),1,results,conclusions,results → conclusions
225,The ipsilateral group showed a more rapid improvement than the contralateral group .,tensor(0),1,background,conclusions,background → conclusions
226,Forty-two patients who underwent concha bullosa surgery ( a total of @ conchae surgeries ) were included in the study .,tensor(4),1,results,conclusions,results → conclusions
227,"There are no enough studies and research on the effect of vitamin B@ on the symptoms of PMS , therefore , this study was conducted to determine the effect of vitamin B@ on the symptoms of PMS in students residing at dormitories of Jahrom University of Medical Sciences in @ .",tensor(3),0,objective,background,objective → background
228,"The severity of the symptoms of PMS in two cycles , before the intervention and during the intervention , was recorded by the students .",tensor(3),0,objective,background,objective → background
229,"The data were collected using an information collection form , PMS provisional diagnosis form , daily status record form , Beck Depression Inventory .",tensor(0),2,background,methods,background → methods
230,The data were analyzed using descriptive and inferential statistics .,tensor(3),0,objective,background,objective → background
231,"Open , randomized , standard-of-care-controlled , multi-centre trial .",tensor(1),0,conclusions,background,conclusions → background
232,Charcot-Marie-Tooth ( CMT ) disease type @A is the most common form of CMT .,tensor(1),0,conclusions,background,conclusions → background
233,The selection of optimal second-line therapy that is often necessary due to the progressive nature of the disease is still a subject of ongoing discussions .,tensor(3),2,objective,methods,objective → methods
234,"A planimetrical analysis analyzed the digital image for the wound sizes and shape factor at baseline , at @ h , and days @ , @ , @ , @ , and @ , postoperatively .",tensor(3),2,objective,methods,objective → methods
235,"Eleven ( @ % ) of @ patients in the supraclavicular group versus @ ( @ % ) of @ in the infraclavicular group had complete hemidiaphragmatic paralysis ( P = @ -LSB- @-tailed -RSB- ; relative risk , @ -LSB- @ % confidence interval , @-@ @ -RSB- ) ; @ % versus @ % had any ( complete or partial ) paralysis ( P = @ ; relative risk , @ -LSB- @ % confidence interval , @-@ @ -RSB- ) .",tensor(3),0,objective,background,objective → background
236,"In a parallel group design , @ men ( @ @ y ) completed unilateral knee-extensor resistance exercise before the ingestion of @ g whey protein ( W@ ) ( @ g leucine ) , @ g whey protein ( W@ ) ( @ g leucine ) , @ g whey protein supplemented with leucine to @ g total leucine ( W@ + Low-Leu ) , @ g whey protein supplemented with leucine to @ g total leucine ( W@ + High-Leu ) , or @ g whey protein supplemented with leucine , isoleucine , and valine to @ g total leucine .",tensor(1),2,conclusions,methods,conclusions → methods
237,The aim of this study was to assess the efficacy of @ weeks of prucalopride treatment compared with placebo in men with chronic constipation .,tensor(4),2,results,methods,results → methods
238,People with prediabetes are at increased risk for developing type @ diabetes mellitus .,tensor(3),0,objective,background,objective → background
239,"Yet , weight loss varies among individuals and some people do not achieve clinically meaningful weight loss after treatment .",tensor(1),0,conclusions,background,conclusions → background
240,Weight change before and after the behavioral intervention among participants randomized to the experimental group was examined .,tensor(4),1,results,conclusions,results → conclusions
241,Mealtime insulin is commonly added to manage hyperglycemia in type @ diabetes when basal insulin is insufficient .,tensor(4),2,results,methods,results → methods
242,Weight decreased with exenatide and increased with lispro ( -@ vs. +@ kg ; P < @ ) .,tensor(4),1,results,conclusions,results → conclusions
243,The study sample was drawn from Gynecologic Oncology Group protocols @ and @ .,tensor(1),2,conclusions,methods,conclusions → methods
244,"In @ patients who were enrolled on Gynecologic Oncology Group @ ( fatigue not measured on @ ) , a worse PS predicted the development of grade @ or @ fatigue ( odds ratio , @ ; @ % confidence interval , @-@ @ ) .",tensor(3),0,objective,background,objective → background
245,Age and treatment regimen ( P < @ ) were associated with the development of grade @ or @ neutropenia .,tensor(3),0,objective,background,objective → background
246,Resistance data on virological failure and mutations in HIV infected populations initiating treatment in sub-Saharan Africa is sparse .,tensor(0),3,background,objective,background → objective
247,VL measurements were done at baseline and after @ and @ months .,tensor(1),4,conclusions,results,conclusions → results
248,Virological failure was observed among @ ( @ % ) participants out of @ patients .,tensor(0),2,background,methods,background → methods
